{
  "$schema": "https://json-schema.org/draft/2020-12/schema",
  "$id": "https://github.com/cooneycw/codex-power-pack/blob/main/.agents/project-init-spec-kit-contract.schema.json",
  "title": "Project Init and Spec Kit Composition Contract",
  "type": "object",
  "additionalProperties": false,
  "required": [
    "$schema",
    "schema_version",
    "tracking_issue",
    "status",
    "runtime_changes",
    "audit",
    "routing",
    "spec_kit",
    "issue_compilation",
    "rollout_ownership"
  ],
  "properties": {
    "$schema": {"const": "./project-init-spec-kit-contract.schema.json"},
    "schema_version": {"const": "1.0"},
    "tracking_issue": {"const": 166},
    "status": {"const": "accepted"},
    "runtime_changes": {"const": false},
    "audit": {
      "type": "object",
      "additionalProperties": false,
      "required": ["surfaces", "contradictions", "duplicate_helpers"],
      "properties": {
        "surfaces": {
          "type": "array",
          "minItems": 6,
          "items": {"$ref": "#/$defs/surface"}
        },
        "contradictions": {
          "type": "array",
          "minItems": 1,
          "items": {"$ref": "#/$defs/contradiction"}
        },
        "duplicate_helpers": {
          "type": "array",
          "minItems": 2,
          "items": {"$ref": "#/$defs/helper"}
        }
      }
    },
    "routing": {
      "type": "object",
      "additionalProperties": false,
      "required": ["default", "project_init_selection", "routes"],
      "properties": {
        "default": {"const": "safe-local-scaffold"},
        "project_init_selection": {"const": "explicit-only"},
        "routes": {
          "type": "array",
          "minItems": 7,
          "items": {"$ref": "#/$defs/route"}
        }
      }
    },
    "spec_kit": {
      "type": "object",
      "additionalProperties": false,
      "required": [
        "upstream",
        "release",
        "commit",
        "install",
        "initialization",
        "composition",
        "readiness_gate"
      ],
      "properties": {
        "upstream": {"const": "https://github.com/github/spec-kit"},
        "release": {"type": "string", "pattern": "^v[0-9]+\\.[0-9]+\\.[0-9]+$"},
        "commit": {"type": "string", "pattern": "^[0-9a-f]{40}$"},
        "install": {"type": "string", "minLength": 1},
        "initialization": {"const": "specify init --here --integration codex"},
        "composition": {
          "type": "object",
          "additionalProperties": false,
          "required": ["choice", "rationale", "rejected"],
          "properties": {
            "choice": {"const": "extension"},
            "rationale": {"type": "string", "minLength": 1},
            "rejected": {
              "type": "array",
              "minItems": 2,
              "items": {
                "type": "object",
                "additionalProperties": false,
                "required": ["choice", "reason"],
                "properties": {
                  "choice": {"enum": ["preset", "bundle", "hand-authored-scaffold"]},
                  "reason": {"type": "string", "minLength": 1}
                }
              }
            }
          }
        },
        "readiness_gate": {
          "type": "object",
          "additionalProperties": false,
          "required": ["approval_required", "result", "checks"],
          "properties": {
            "approval_required": {"const": true},
        "result": {"const": "ready-only-when-all-checks-pass"},
            "checks": {
              "type": "array",
              "minItems": 9,
              "items": {"$ref": "#/$defs/readiness_check"}
            }
          }
        }
      }
    },
    "issue_compilation": {
      "type": "object",
      "additionalProperties": false,
      "required": [
        "owner",
        "default_granularity",
        "task_granularity",
        "stable_identity",
        "required_body_sections",
        "immutable_links",
        "mapping_write_back",
        "idempotency_scope"
      ],
      "properties": {
        "owner": {"const": "spec-sync"},
        "default_granularity": {"const": "stage-or-story"},
        "task_granularity": {"const": "explicit-request-only"},
        "stable_identity": {"type": "string", "minLength": 1},
        "required_body_sections": {
          "type": "array",
          "minItems": 10,
          "items": {
            "enum": [
              "outcome",
              "tasks",
              "user-story-traceability",
              "acceptance-checkpoint",
              "dependencies",
              "constraints",
              "quality-commands",
              "immutable-artifact-links",
              "sync-identity",
              "mapping-write-back"
            ]
          },
          "uniqueItems": true
        },
        "immutable_links": {"type": "string", "minLength": 1},
        "mapping_write_back": {"type": "string", "minLength": 1},
        "idempotency_scope": {"const": "open-and-closed-issues"}
      }
    },
    "rollout_ownership": {
      "type": "array",
      "minItems": 6,
      "maxItems": 6,
      "items": {"$ref": "#/$defs/ownership"}
    }
  },
  "$defs": {
    "surface": {
      "type": "object",
      "additionalProperties": false,
      "required": ["repository", "path", "kind"],
      "properties": {
        "repository": {"enum": ["codex-power-pack", "claude-power-pack"]},
        "path": {"type": "string", "minLength": 1},
        "kind": {
          "enum": [
            "skill",
            "agent-metadata",
            "help",
            "plugin-manifest",
            "workflow",
            "issue-compiler"
          ]
        }
      }
    },
    "contradiction": {
      "type": "object",
      "additionalProperties": false,
      "required": ["id", "promise", "actual", "owner_issue"],
      "properties": {
        "id": {"type": "string", "pattern": "^PIC-[0-9]{3}$"},
        "promise": {"type": "string", "minLength": 1},
        "actual": {"type": "string", "minLength": 1},
        "owner_issue": {"type": "integer", "minimum": 158, "maximum": 163}
      }
    },
    "helper": {
      "type": "object",
      "additionalProperties": false,
      "required": ["repository", "path", "sha256", "disposition", "owner_issue"],
      "properties": {
        "repository": {"enum": ["codex-power-pack", "claude-power-pack"]},
        "path": {"type": "string", "minLength": 1},
        "sha256": {"type": "string", "pattern": "^[0-9a-f]{64}$"},
        "disposition": {"const": "retire-in-favor-of-spec-sync"},
        "owner_issue": {"const": 160}
      }
    },
    "route": {
      "type": "object",
      "additionalProperties": false,
      "required": ["intent", "owner", "selection", "consent", "project_init_negative"],
      "properties": {
        "intent": {
          "enum": [
            "new-local-python-project",
            "existing-repository-orientation",
            "next-work-recommendation",
            "github-publication",
            "spec-kit-adoption",
            "issue-compilation",
            "persistent-influence"
          ]
        },
        "owner": {
          "enum": [
            "project-init",
            "project-lite",
            "project-next",
            "github-publication-workflow",
            "spec-adopt",
            "spec-sync",
            "cxpp-init"
          ]
        },
        "selection": {"enum": ["explicit", "explicit-or-narrow-implicit"]},
        "consent": {"enum": ["target-path", "separate-explicit", "read-only"]},
        "project_init_negative": {"type": "boolean"}
      }
    },
    "readiness_check": {
      "type": "object",
      "additionalProperties": false,
      "required": ["id", "failure"],
      "properties": {
        "id": {
          "enum": [
            "spec-exists",
            "plan-exists",
            "tasks-exist",
            "consistency-analysis-clean",
            "no-placeholders",
            "exact-paths",
            "independent-tests",
            "dependencies-explicit",
            "user-approved"
          ]
        },
        "failure": {"type": "string", "minLength": 1}
      }
    },
    "ownership": {
      "type": "object",
      "additionalProperties": false,
      "required": ["issue", "stage", "responsibilities", "acceptance_evidence"],
      "properties": {
        "issue": {"type": "integer", "minimum": 158, "maximum": 163},
        "stage": {"type": "string", "minLength": 1},
        "responsibilities": {
          "type": "array",
          "minItems": 1,
          "items": {"type": "string", "minLength": 1}
        },
        "acceptance_evidence": {
          "type": "array",
          "minItems": 1,
          "items": {"type": "string", "minLength": 1}
        }
      }
    }
  }
}
